{
  "$schema": "https://json-schema.org/draft/2020-12/schema",
  "title": "post_copy",
  "description": "Output of 07_COVERS: the caption of the post (decision D-17, 2026-10-23). Contract proposal: docs/visual-layer/caption-cta-proposal.md section 4.1.",
  "type": "object",
  "additionalProperties": false,
  "required": [
    "job_id",
    "stage",
    "config_source",
    "config_version",
    "model",
    "execution_id",
    "created_at",
    "evidence_ids",
    "caption"
  ],
  "properties": {
    "job_id": {
      "type": "string",
      "pattern": "^[0-9a-f]{8}-[0-9a-f]{4}-[0-9a-f]{4}-[0-9a-f]{4}-[0-9a-f]{12}$",
      "description": "editorial.jobs.id; existence is checked by code"
    },
    "stage": {
      "const": "07_COVERS",
      "description": "stage that produced the row"
    },
    "config_source": {
      "enum": [
        "public",
        "private"
      ]
    },
    "config_version": {
      "type": "string",
      "minLength": 1
    },
    "model": {
      "type": "string",
      "minLength": 1,
      "description": "model name, or not_reported when the stage used no LLM"
    },
    "execution_id": {
      "type": "string",
      "minLength": 1
    },
    "created_at": {
      "type": "string",
      "pattern": "^[0-9]{4}-[0-9]{2}-[0-9]{2}T[0-9]{2}:[0-9]{2}:[0-9]{2}(\\.[0-9]+)?Z$",
      "description": "ISO 8601 in UTC, with the Z suffix"
    },
    "evidence_ids": {
      "type": "array",
      "minItems": 1,
      "items": {
        "type": "string",
        "minLength": 1
      },
      "description": "each id must exist in verification and be VERIFIED; checked by code. Every claim of the caption needs evidence (CLAUDE.md sections 4 and 8)"
    },
    "caption": {
      "type": "string",
      "minLength": 1,
      "maxLength": 300,
      "description": "post text, written below the image on the platform; it is not on the art. Length in code points. Blank text, hashtags, mentions, blocklist and numbers are checked by code"
    }
  }
}
