{
  "job_id": "00000000-0000-4000-8000-000000000001",
  "stage": "07_COVERS",
  "config_source": "public",
  "config_version": "v1",
  "model": "synthetic-model-v0",
  "execution_id": "exec-0001",
  "created_at": "2026-10-23T12:00:00Z",
  "evidence_ids": [
    "ev-0001"
  ],
  "caption": "De 84% para 92% no indicador sintético. O que mudou, em uma frase curta."
}
